### ISSUE TITLE
RADIUS Outpost drops packets with "invalid message authenticator" from clients

### ISSUE THREAD

**Issue by vncsmntr** [goauthentik/authentik#22931]
### Describe the bug

The Authentik RADIUS Outpost fails to validate incoming Access-Request packets from multiple distinct RADIUS clients, specifically a FortiGate firewall and the Windows NTRadPing diagnostic utility. In all cases, the outpost logs an "error":"invalid message authenticator" warning and silently drops the communication.

This happens even with a completely fresh deployment, a simplified alphanumeric Shared Secret, and when running the outpost in host network mode to isolate and rule out any Docker SNAT/Gateway masking issues.

Environment
authentik version: 2026.5.2 (RADIUS image: ghcr.io/goauthentik/radius:2026.5.2)

Deployment method: Docker Compose (tested both in default bridge and network_mode: "host")

Affected RADIUS Clients:

FortiGate Firewall (FortiOS v7.2.8)

NTRadPing (Standard Windows RADIUS Test Utility)

Authentication Protocol: PAP / CHAP / MSCHAPv2

### How to reproduce

Create a brand new RADIUS Provider with a simple alphanumeric Shared Secret and Client Networks set to 0.0.0.0/0.

Create a Radius Outpost, bind it to the provider, and fetch the token.

Deploy the outpost using Docker Compose.

Test Client 1 (FortiGate CLI): Trigger a manual authentication test using PAP: diagnose test authserver radius <server_name> pap <username> <password>

Test Client 2 (Windows NTRadPing): Fill in the Server IP, Port 1812, the exact same Shared Secret, select `PAP` (or `CHAP`), and send an `Authentication Request`.

Both clients trigger the exact same log signature. The container receives the inbound UDP packet but fails the internal message authenticator validation check, dropping the packet without generating an outbound RADIUS response (`Access-Accept` or `Access-Reject`), causing a timeout on the client side:

{"code":"Access-Request","event":"Radius Request","id":0,"ip":"<client_ip>","level":"info","logger":"authentik.outpost.radius","request":"<request_uuid>","timestamp":"2026-06-08T15:33:36Z"}
{"code":"Access-Request","error":"invalid message authenticator","event":"Invalid message authenticator","id":0,"ip":"<client_ip>","level":"warning","logger":"authentik.outpost.radius","request":"<request_uuid>","timestamp":"2026-06-08T15:33:36Z"}

A host-level tcpdump confirms that inbound UDP packets on port 1812 are hitting the interface and reaching the container, but the outpost remains completely silent due to this hashing failure.

### Expected behavior

The RADIUS Outpost should successfully validate the authenticator hash using the configured Shared Secret regardless of the client software, communicate with the core server to process the authentication flow, and return the proper RADIUS reply.

### Screenshots

<img width="1512" height="142" alt="Image" src="https://github.com/user-attachments/assets/134943e8-6137-48d1-829c-8fc29efae904" />

### Additional context

Initially, this behavior was thought to be a side-effect of the recent BlastRADIUS mitigation enforcement patches found in newer vendor firmwares. However, because this issue reproduces identically using a legacy FortiOS (7.2.8) and a traditional utility like NTRadPing on Windows, it points directly to an internal hashing regression within the Go-RADIUS library implementation used by the outpost. Completely deleting and recreating the providers/outposts to flush any potential Redis API cache did not mitigate the issue.

### Deployment Method

Docker

### Version

2026.5.2

### Relevant log output

```shell
Host Packet Capture (tcpdump -ni any udp port 1812)
The packet capture on the Docker host confirms that inbound UDP traffic arrives at the physical interface (ens18) from the Windows with NTRadPing (10.181.210.131), gets successfully routed into the Docker bridge network interface (br-dd9ed0111258), and reaches the container's internal IP (172.18.0.3). However, no outbound reply is ever generated by the outpost:

listening on any, link-type LINUX_SLL2 (Linux cooked v2), snapshot length 262144 bytes
15:33:36.309555 ens18 In  IP 10.181.210.131.64208 > 198.18.128.136.1812: RADIUS, Access-Request (1), id: 0x02 length: 57
15:33:36.309633 br-dd9ed0111258 Out IP 10.181.210.131.64208 > 172.18.0.3.1812: RADIUS, Access-Request (1), id: 0x02 length: 57
15:33:36.309638 vethc43c74e Out IP 10.181.210.131.64208 > 172.18.0.3.1812: RADIUS, Access-Request (1), id: 0x02 length: 57
15:33:39.322573 ens18 In  IP 10.181.210.131.64208 > 198.18.128.136.1812: RADIUS, Access-Request (1), id: 0x02 length: 57
15:33:39.322797 br-dd9ed0111258 Out IP 10.181.210.131.64208 > 172.18.0.3.1812: RADIUS, Access-Request (1), id: 0x02 length: 57
15:33:39.322829 vethc43c74e Out IP 10.181.210.131.64208 > 172.18.0.3.1812: RADIUS, Access-Request (1), id: 0x02 length: 57
15:33:42.333370 ens18 In  IP 10.181.210.131.64208 > 198.18.128.136.1812: RADIUS, Access-Request (1), id: 0x02 length: 57
15:33:42.333404 br-dd9ed0111258 Out IP 10.181.210.131.64208 > 172.18.0.3.1812: RADIUS, Access-Request (1), id: 0x02 length: 57
15:33:42.333409 vethc43c74e Out IP 10.181.210.131.64208 > 172.18.0.3.1812: RADIUS, Access-Request (1), id: 0x02 length: 57
```

**Comment by BeryJu** [comment]
Our implementation for checking Message-Authenticator used to be broken until https://github.com/goauthentik/authentik/pull/21824 which fixes the issue (but that's already included in 2026.5)

If you're able to sniff traffic with wireshark, does that show the packets as having a valid or an invalid authenticator?

**Comment by Max-s1** [comment]
I can confirm this issue is still present in Authentik 2026.5.3 with a pfSense CE 2.8.1 RADIUS client.
Environment:

Authentik version: 2026.5.3 (RADIUS outpost)
RADIUS client: pfSense CE 2.8.1-RELEASE (amd64), FreeBSD 15.0-CURRENT, built Mon Dec 15 18:31:00 CET 2025
Authentication protocol: PAP
Shared secret: simple alphanumeric (confirmed identical on both sides)

Observed behavior:
Authentik receives the Access-Request but immediately drops it with "invalid message authenticator". The pfSense client gets no response and times out.
Exact log output from Authentik:
{"code":"Access-Request","event":"Radius Request","ip":"<firewall-ip>","level":"info","logger":"authentik.outpost.radius"}
{"code":"Access-Request","error":"invalid message authenticator","event":"Invalid message authenticator","ip":"<firewall-ip>","level":"warning","logger":"authentik.outpost.radius"}
Additional context:
Interestingly, a pfSense+ 26.03-RELEASE (amd64) on FreeBSD 16.0-CURRENT works correctly with the same Authentik instance and identical configuration. This suggests the fix in #21824 may only accommodate newer RADIUS client implementations, while older/different client behaviors still trigger the validation failure.
The fix from #21824 does not fully resolve the issue for all RADIUS clients. Please consider making Message-Authenticator validation more lenient or RFC-compliant for legacy clients.

**Comment by ChrisPortman** [comment]
I am seeing the same behavior from Cisco Nexus 9ks

**Comment by rjmidau** [comment]
I am seeing the same behaviour from APC UPS (NMC2)

**Comment by Fantorangen** [comment]
We see the same with the utility ntradping, which is easy to reproduce and commonly used to test Radius implementations.
Radclient from FreeRadius succeeds. Looking into the two different Access-Request packets, I see the one failing is missing Message-Authenticator attribute?

This attribute should perhaps not be mandatory @BeryJu, as if I read the RFC2869 correctly, it is optional?
https://www.freeradius.org/rfc/rfc2869.html#Message-Authenticator

**Comment by BeryJu** [comment]
This is why I was asking for a pcap if possible, but us requiring the message-authenticator attribute is most likely the issue

**Comment by holmesb** [comment]
Seems like fix is en-route, but me too on X11 generation Supermicro motherboard IPMI:
```
{"code":"Access-Request","event":"Radius Request",...}
{"code":"Access-Request","error":"invalid message authenticator","event":"Invalid message authenticator",...}
```
Works fine on newer X13 gen. Identically configured. Consistent with @Fantorangen's finding that the failing requests are missing Message-Authenticator entirely, though I haven't pcap'd our own traffic yet to confirm.

**Comment by Fantorangen** [comment]
Tested 2026.8 right now and ntradping succeedes with Access-Accept, fix seems good! Thank you @BeryJu !
